{
  "$schema": "../../../../../../../../specs/schema/feature.schema.json",
  "schema": 2,
  "id": "102",
  "title": "Beta | the slip one",
  "workItem": "P1.2",
  "status": "in-progress",
  "owner": "tester",
  "dates": { "created": "2026-01-02", "approved": "2026-01-02", "started": "2026-01-03", "done": null },
  "git": { "branch": "feat/102-beta" },
  "spec": {
    "phase": "1 — Basics",
    "summary": "Beta slips.\n\nIt slips **left**.",
    "stories": { "order": [], "byId": {} },
    "criteria": {
      "order": ["AC-1", "AC-2"],
      "byId": {
        "AC-1": { "text": "Beta slips.", "proof": "unit", "group": "Slipping", "done": false },
        "AC-2": { "text": "Beta has docs.", "proof": "manual", "group": "Docs", "done": false }
      }
    },
    "questions": { "order": ["Q1"], "byId": { "Q1": { "text": "Which way? _Proposed:_ left.", "open": true } } },
    "changelog": [{ "date": "2026-01-02", "text": "Created." }],
    "sections": [
      { "kind": "summary", "title": "Summary" },
      { "kind": "criteria", "title": "Acceptance Criteria" },
      { "kind": "markdown", "title": "Out of Scope", "markdown": "- Sliding right." },
      { "kind": "questions", "title": "Open Questions" },
      { "kind": "changelog", "title": "Changelog" }
    ]
  },
  "plan": {
    "header": "**Spec:** `./spec.md` · **Status:** Approved",
    "files": [{ "file": "`b.ts`, `b.test.ts`", "change": "new", "purpose": "beta \\| slip" }],
    "risks": [{ "text": "**Slips too far:** clamp it." }],
    "constitution": [{ "principle": "I. Spec before code", "status": "✅", "notes": "" }],
    "sections": [
      { "kind": "markdown", "title": "Approach", "markdown": "Make beta slip **left**. See [the spec](./spec.md)." },
      { "kind": "files", "title": "Files" },
      { "kind": "risks", "title": "Risks & Mitigations" },
      { "kind": "constitution", "title": "Constitution Check" }
    ]
  },
  "tasks": {
    "intro": "**Plan:** `./plan.md`",
    "sections": [
      { "title": "Core", "intro": null },
      { "title": "Verify", "intro": "Checked by hand." }
    ],
    "items": {
      "order": ["T001", "T002", "T003", "T004"],
      "byId": {
        "T001": {
          "text": "Tests for beta.",
          "section": "Core",
          "status": "done",
          "blockedReason": null,
          "parallel": false,
          "manual": false,
          "covers": ["AC-1"],
          "files": ["b.test.ts"],
          "test": "fails",
          "startedOn": "2026-01-03",
          "doneOn": "2026-01-03",
          "commits": [],
          "notes": []
        },
        "T002": {
          "text": "Beta.",
          "section": "Core",
          "status": "in-progress",
          "blockedReason": null,
          "parallel": false,
          "manual": false,
          "covers": ["AC-1"],
          "files": ["b.ts"],
          "test": "T001",
          "startedOn": "2026-01-03",
          "doneOn": null,
          "commits": [],
          "notes": []
        },
        "T003": {
          "text": "Docs, checked by hand.",
          "section": "Verify",
          "status": "blocked",
          "blockedReason": "Waits for the maintainer.",
          "parallel": true,
          "manual": true,
          "covers": ["AC-2"],
          "files": ["README.md"],
          "test": "manual read",
          "startedOn": null,
          "doneOn": null,
          "commits": [],
          "notes": ["**Status (2026-01-03):** asked.\nTwo lines."]
        },
        "T004": {
          "text": "Release.",
          "section": "Verify",
          "status": "todo",
          "blockedReason": null,
          "parallel": false,
          "manual": false,
          "covers": [],
          "files": [],
          "test": null,
          "startedOn": null,
          "doneOn": null,
          "commits": [],
          "notes": []
        }
      }
    }
  }
}
