{
  "$schema": "../../schema/feature.schema.json",
  "schema": 2,
  "id": "NNN",
  "title": "<Feature name>",
  "workItem": null,
  "status": "draft",
  "owner": null,
  "dates": { "created": "2000-01-01", "approved": null, "started": null, "done": null },
  "git": { "branch": null },
  "spec": {
    "phase": null,
    "summary": "One paragraph: what this feature is and why it matters to its users.",
    "stories": { "order": [], "byId": {} },
    "criteria": { "order": [], "byId": {} },
    "questions": { "order": [], "byId": {} },
    "changelog": [],
    "sections": [
      { "kind": "summary", "title": "Summary" },
      { "kind": "stories", "title": "User Stories" },
      { "kind": "criteria", "title": "Acceptance Criteria" },
      {
        "kind": "markdown",
        "title": "Non-Functional Requirements",
        "markdown": "- Performance: …\n- Accessibility / security / compatibility: …"
      },
      { "kind": "markdown", "title": "Out of Scope", "markdown": "- …" },
      { "kind": "questions", "title": "Open Questions" },
      { "kind": "changelog", "title": "Changelog" }
    ]
  },
  "plan": null,
  "tasks": null
}
